0961102046,全家便利商店復昌店,信義區,光復南路503號,全家,,,0,305441.629,2769667.119,www.family.com.tw/Marketing/index.aspx,,0,,,,休閒購物,生活購物,便利商店,,
0950506896,全家便利商店,中正區,襄陽路7號,全家,,,0,301223.792,2770898.722,www.family.com.tw/Marketing/index.aspx,,0,,,,休閒購物,生活購物,便利商店,,
0950507319,全家便利商店光輝店,中山區,德惠街34號,,,,0,302254.297,2773460.16,,,0,,,,休閒購物,生活購物,便利商店,,
0971102226,全家便利商店華園店,萬華區,西園路二段140巷32號,全家,,,0,299167.947,2769506.334,www.family.com.tw/Marketing/index.aspx,,0,,,,休閒購物,生活購物,便利商店,,
0970800008,全家便利商店,中正區,重慶南路一段58號,,,,0,300944.306,2770943.711,,,,,,光復里,休閒購物,生活購物,便利商店,,
0950504186,全家便利商店成鑫店,南港區,玉成街178號1樓,,,,0,308153.302,2770992.683,,,0,,,鴻福里,休閒購物,生活購物,便利商店,,
0950500465,全家便利商店台醫店,中正區,中山南路7號,全家,,,0,301495.629,2770598.281,www.family.com.tw/Marketing/index.aspx,,0,,,,休閒購物,生活購物,便利商店,,
0951205113,全家便利商店長津店,中山區,長安東路一段15號,全家,,,0,301914.675,2771586.481,www.family.com.tw/Marketing/index.aspx,,0,,,,休閒購物,生活購物,便利商店,,
0971105264,全家便利商店南機場店,中正區,中華路二段311巷3號,,,,,300216.711,2769225.573,,,,,,忠勤里,休閒購物,生活購物,便利商店,,
0971102225,全家便利商店重陽店,南港區,重陽路185號,全家,,,0,309587.516,2772399.352,www.family.com.tw/Marketing/index.aspx,,0,,,,休閒購物,生活購物,便利商店,,
0970803532,全家便利商店,北投區,實踐街51號,全家,,,0,300563.089,2778851.5,www.family.com.tw/Marketing/index.aspx,,0,,,尊賢里,休閒購物,生活購物,便利商店,,
0971102222,全家便利商店水源店,中正區,汀州路三段261號,全家,,,0,303186.994,2767512.503,www.family.com.tw/Marketing/index.aspx,,0,,,,休閒購物,生活購物,便利商店,,
0951206464,全家便利店,士林區,美崙街35號1樓,,,,0,301914.63,2776839.434,,,0,,,福佳里,休閒購物,生活購物,便利商店,,
0980701080,全家便利商店豐華店,松山區,民生東路三段113巷6弄1號,全家,,,0,304268.762,2772588.443,www.family.com.tw/Marketing/index.aspx,,0,,,,休閒購物,生活購物,便利商店,,
0951205829,全家便利商店,松山區,南京東路三段258號,全家,,,0,304141.789,2771810.932,www.family.com.tw/Marketing/index.aspx,,0,,,,休閒購物,生活購物,便利商店,,
0961101925,全家便利商店寶清店,松山區,八德路四段598號,全家,,,0,306928.312,2771619.69,www.family.com.tw/Marketing/index.aspx,,0,,,,休閒購物,生活購物,便利商店,,
0980701077,全家便利商店太原店,大同區,太原路81號,全家,,,0,301204.949,2771827.172,www.family.com.tw/Marketing/index.aspx,,0,,,,休閒購物,生活購物,便利商店,,
0961100058,全家便利商店忠隆店,信義區,忠孝東路五段71巷9號,全家,,,0,306424.686,2770743.882,www.family.com.tw/Marketing/index.aspx,,0,,,,休閒購物,生活購物,便利商店,,
0961108275,全家便利商店成都店,萬華區,成都路86號,全家,,,0,300091.166,2770836.857,www.family.com.tw/Marketing/index.aspx,,0,,,,休閒購物,生活購物,便利商店,,
0971102847,全家便利商店,士林區,前港街39號,,,,,301769.661,2775479.259,,,,,,前港里,休閒購物,生活購物,便利商店,,
0971102224,全家便利商店松仁店,信義區,信義路五段150巷221號,全家,,,0,306573.675,2769250.37,www.family.com.tw/Marketing/index.aspx,,0,,,,休閒購物,生活購物,便利商店,,
0981005019,全家便利商店信美店,大安區,信義路三段134巷2號,,,,,303598.939,2769745.761,,,,,,龍圖里,休閒購物,生活購物,便利商店,,
0981014853,全家便利商店新瑞店,內湖區,堤頂大道二段407巷26號,全家,,,0,306040.062,2775088.348,www.family.com.tw/Marketing/index.aspx,,0,,,,休閒購物,生活購物,便利商店,,
0981015374,全家便利商店瑞湖店,內湖區,瑞光路513巷39號,全家,,,0,306697.051,2774971.343,www.family.com.tw/Marketing/index.aspx,,0,,,,休閒購物,生活購物,便利商店,,
0971102228,全家便利商店綠堤店,萬華區,環河南路二段173號,全家,,,0,298852.248,2769717.725,www.family.com.tw/Marketing/index.aspx,,0,,,,休閒購物,生活購物,便利商店,,
0980701079,全家便利商店福泰店,中山區,民生東路一段34號,全家,,,0,302063.914,2772501.047,www.family.com.tw/Marketing/index.aspx,,0,,,,休閒購物,生活購物,便利商店,,
0990801901,全家便利商店,萬華區,興義街6號,,,,,298787.598,2769025.93,,,,,,和德里,休閒購物,生活購物,便利商店,,
0971106071,全家便利商店新青年店,萬華區,青年路6號,,,,,300255.582,2768972.588,,,,,,新和里,休閒購物,生活購物,便利商店,,
0971107298,全家便利商店南機場店,中正區,中華路二段311巷1號,,,,,300211.19,2769220.86,,,,,,忠勤里,休閒購物,生活購物,便利商店,,
0971102223,全家便利商店酉陽店,中正區,永綏街20號,全家,,,0,300713.279,2770842.823,www.family.com.tw/Marketing/index.aspx,,0,,,,休閒購物,生活購物,便利商店,,
0980701078,全家便利商店萬隆店,文山區,羅斯福路五段218巷38弄2號,全家,,,0,303361.107,2766331.479,www.family.com.tw/Marketing/index.aspx,,0,,,,休閒購物,生活購物,便利商店,,
0981004280,全家便利商店,文山區,汀州路四段75號,全家,,,0,303419.206,2766986.079,www.family.com.tw/Marketing/index.aspx,,0,,,,休閒購物,生活購物,便利商店,,
0990801897,全家便利商店,北投區,西安街一段283號,,,,,301281.038,2778490.061,,,,,,榮光里,休閒購物,生活購物,便利商店,,
0981019702,全家便利商店東光店,松山區,南京東路五段123巷1之2號,全家,,,0,305744.156,2771878.464,www.family.com.tw/Marketing/index.aspx,,0,,,,休閒購物,生活購物,便利商店,,
0981014408,全家便利商店衡山店,中山區,通北街132巷1號,,,,0,303390.652,2775455.832,,,0,,,,休閒購物,生活購物,便利商店,,
0991003914,全家便利商店,信義區,松壽路22號1樓,,,,,306460.423,2770041.186,,,,,,西村里,休閒購物,生活購物,便利商店,,
0981006287,全家便利商店四維店,大安區,四維路154巷1號,全家,,,0,304446.548,2769536.923,www.family.com.tw/Marketing/index.aspx,,0,,,,休閒購物,生活購物,便利商店,,
0981019216,全家便利商店健康店,松山區,健康路100號,全家,,,0,305171.18,2772009.836,www.family.com.tw/Marketing/index.aspx,,0,,,,休閒購物,生活購物,便利商店,,
0981015341,全家便利商店,內湖區,瑞光路413號1樓,,,,,306817.35,2774797.26,,,,,,港墘里,休閒購物,生活購物,便利商店,,
0981005474,全家便利商店敦隆店,大安區,敦化南路二段200巷16號,,,,0,304433.743,2768616.703,,,0,,,,休閒購物,生活購物,便利商店,,
0981010107,全家便利商店長林店,中山區,林森北路107巷54號,全家,,,0,302318.272,2771601.328,www.family.com.tw/Marketing/index.aspx,,0,,,,休閒購物,生活購物,便利商店,,
0981006883,全家便利商店股份有限公司,大安區,復興南路一段215號2樓,,,,,304058.387,2770430.032,,,,,,仁愛里,休閒購物,生活購物,便利商店,,
1001001128,全家便利商店吉原店,中山區,中原街27號1樓,,,,,302539.064,2772334.785,,,,,,中原里,休閒購物,生活購物,便利商店,,
1001005416,全家便利商店,中山區,長安東路二段216號,,,,,303899.859,2771428.683,,,,,,朱崙里,休閒購物,生活購物,便利商店,,
1001004117,全家便利商店,中山區,林森北路109號,,,,,302146.648,2771669.923,,,,,,正義里,休閒購物,生活購物,便利商店,,
1001000460,全家便利商店,松山區,三民路148號,,,,,306007.733,2772863.785,,,,,,富錦里,休閒購物,生活購物,便利商店,,
1001000003,全家便利商店京江店,中山區,一江街22號,,,,,302787.845,2771921.84,,,,,,中吉里,休閒購物,生活購物,便利商店,,
1001006273,全家便利商店興亞店,中山區,南京東路二段26號,,,,,302548.779,2771832.766,,,,,,興亞里,休閒購物,生活購物,便利商店,,
1001002588,全家便利商店華視店,大安區,光復南路116巷26號1樓,,,,,305332.234,2770858.99,,,,,,華聲里,休閒購物,生活購物,便利商店,,
1001004614,全家便利商店新松店,中山區,松江路330巷33號1樓,,,,,302821.444,2772866.809,,,,,,新生里,休閒購物,生活購物,便利商店,,
1001000277,全家便利商店,松山區,八德路四段40號,,,,,305597.363,2771439.558,,,,,,復盛里,休閒購物,生活購物,便利商店,,
0990801905,全家便利商店富民店,萬華區,萬大路493巷48弄23之4號,,,,,299560.623,2768234.953,,,,,,興德里,休閒購物,生活購物,便利商店,,
0990801902,全家便利商店寶元店,萬華區,寶興街40號,,,,,298956.619,2769089.545,,,,,,和德里,休閒購物,生活購物,便利商店,,
1010800175,全家便利商店,信義區,市府路45號地下1層,,,,,306074.621,2769869.038,,,,,,西村里,休閒購物,生活購物,便利商店,,
0990801904,全家便利商店,萬華區,長泰街2號,,,,,299772.174,2768637.761,,,,,,壽德里,休閒購物,生活購物,便利商店,,
1011000589,全家便利商店永興店,北投區,大同街214號,,,,,299519.71,2781430.482,,,,,,中庸里,休閒購物,生活購物,便利商店,,
1010800053,全家便利商店士商店,士林區,中正路503號,,,,,301417.825,2776241.643,,,,,,後港里,休閒購物,生活購物,便利商店,,
1011000588,全家便利商店,士林區,文林路27號,,,,,302144.709,2775652.286,,,,,,義信里,休閒購物,生活購物,便利商店,,
0981015196,全家便利商店,內湖區,內湖路一段593號,全家,,,0,307002.405,2775075.645,www.family.com.tw/Marketing/index.aspx,,0,,,,休閒購物,生活購物,便利商店,,
0981017865,全家便利商店,文山區,木柵路三段55號,,,,,306344.598,2764845.915,,,,,,木柵里,休閒購物,生活購物,便利商店,,
1020801610,全家便利商店敦中店,松山區,敦化北路4巷13號,,,,,304339.688,2771639.024,,,,,,中正里,休閒購物,生活購物,便利商店,,
0991003916,全家便利商店葫東店,士林區,重慶北路四段188號,,,,,300810.01,2775455.209,,,,,,葫東里,休閒購物,生活購物,便利商店,,
0991003913,全家便利商店,中正區,開封街一段41號,,,,,300884.832,2771181.508,,,,,,光復里,休閒購物,生活購物,便利商店,,
0991005257,全家便利商店文化店,北投區,中央北路二段99號,,,,0,299095.456,2781232.417,,,0,,,豐年里,休閒購物,生活購物,便利商店,,
1001000370,全家便利商店信大店,松山區,八德路四段758號,,,,0,307583.76,2771654.798,,,0,,,慈祐里,休閒購物,生活購物,便利商店,,
1021002858,全家便利商店金瑞店,內湖區,金龍路224號,,,,,308350.499,2775886.183,,,,,,金瑞里,休閒購物,生活購物,便利商店,,
1021002859,全家便利商店,中山區,北安路819之1號,,,,,305271.706,2775506.718,,,,,,北安里,休閒購物,生活購物,便利商店,,
1001005847,全家便利商店福康店,大安區,信義路二段198巷6號1樓,,,,,302686.981,2769747.45,,,,,,福住里,休閒購物,生活購物,便利商店,,
1021006076,全家便利商店金漾店,中山區,林森北路308號,,,,,302171.681,2772298.719,,,,,,中山里,休閒購物,生活購物,便利商店,,
1001009808,全家便利商店,中山區,農安街26之3號,,,,,302257.422,2773262.358,,,,,,恆安里,休閒購物,生活購物,便利商店,,
1001007686,全家便利商店喬治店,大安區,基隆路二段172號,,,,,305156.394,2769037.87,,,,,,法治里,休閒購物,生活購物,便利商店,,
1001007865,全家便利商店富錦店,松山區,富錦街529號,,,,0,306215.474,2772886.728,,,0,,,新益里,休閒購物,生活購物,便利商店,,
1011002539,全家便利商店聯合店,信義區,忠孝東路四段553巷6弄17號,,,,,306031.777,2770789.711,,,,,,新仁里,休閒購物,生活購物,便利商店,,
1011002538,全家便利商店台開店,中正區,重慶南路一段18號,,,,,300945.796,2771201.92,,,,,,光復里,休閒購物,生活購物,便利商店,,
1021002861,全家便利商店新橋店,大同區,延平北路三段25之3號,,,,,300745.224,2773218.72,,,,,,隆和里,休閒購物,生活購物,便利商店,,
1020801609,全家便利商店鑫德店,松山區,八德路二段400號,,,,,304319.106,2771414.389,,,,,,中崙里,休閒購物,生活購物,便利商店,,
1021006081,全家便利商店明湖店,內湖區,東湖路33巷17號,,,,,311030.735,2773859.747,,,,,,安湖里,休閒購物,生活購物,便利商店,,
1021006079,全家便利商店,內湖區,康寧路一段79號,,,,,308976.637,2774963.212,,,,,,紫星里,休閒購物,生活購物,便利商店,,
1021002854,全家便利商店明興門市,文山區,木柵路二段109巷25弄2號,,,,,305998.35,2764995.453,,,,,,明興里,休閒購物,生活購物,便利商店,,
0950119771,全家便利商店光明店,北投區,光明路25號,全家,,,0,299508.735,2780767.254,www.family.com.tw/Marketing/index.aspx,FamilyMart Co Guangming Branch,0,,,,休閒購物,生活購物,便利商店,,
0950119773,全家便利商店光華店,中山區,松江路24之1號,全家,,,0,302922.528,2771292.587,www.family.com.tw/Marketing/index.aspx,FamilyMart Co Guanghua Branch,0,,,,休閒購物,生活購物,便利商店,,
0950119775,全家便利商店吉利店,萬華區,東園街12號,全家,,,0,299172.776,2769141.257,www.family.com.tw/Marketing/index.aspx,FamilyMart Co Jili Branch,0,,,,休閒購物,生活購物,便利商店,,
0950119777,全家便利商店名門店,文山區,軍功路109號,全家,,,0,306488.549,2766674.224,www.family.com.tw/Marketing/index.aspx,FamilyMart Co Mingmen Branch,0,,,,休閒購物,生活購物,便利商店,,
0950119818,全家便利商店松林店,信義區,虎林街69號,全家,,,0,307399.254,2771187.264,www.family.com.tw/Marketing/index.aspx,FamilyMart Co Songlin Branch,0,,,,休閒購物,生活購物,便利商店,,
0950119896,全家便利商店陽大店,北投區,立農街二段155號,全家,,,0,300932.84,2779332.849,www.family.com.tw/Marketing/index.aspx,FamilyMart Co Yang-Ming University Branch,0,,,,休閒購物,生活購物,便利商店,,
0950119940,全家便利商店興安店,中山區,興安街57號,全家,,,0,303881.16,2772315.921,www.family.com.tw/Marketing/index.aspx,FamilyMart Co Xingan Branch,0,,,,休閒購物,生活購物,便利商店,,
0950119970,全家便利商店寶興店,萬華區,寶興街78號,全家,,,0,299045.897,2768961.698,www.family.com.tw/Marketing/index.aspx,FamilyMart Co Baoxing Branch,0,,,,休閒購物,生活購物,便利商店,,
0950131445,全家便利商店,中山區,大直街11號,,,,0,304299.714,2775044.659,,,0,,,,休閒購物,生活購物,便利商店,,
0950156090,全家便利商店全家磺溪店,士林區,天母西路40之1號,全家,,,0,302212.304,2779182.674,www.family.com.tw/Marketing/index.aspx,,0,,,,休閒購物,生活購物,便利商店,,
0950156158,全家便利商店福安店,大同區,長安西路54號,全家,,,0,301625.541,2771635.912,www.family.com.tw/Marketing/index.aspx,,0,,,,休閒購物,生活購物,便利商店,,
0950506916,全家便利商店錦原店,中山區,中原街101號,全家,,,0,302543.239,2772835.601,www.family.com.tw/Marketing/index.aspx,,0,,,,休閒購物,生活購物,便利商店,,
0961103082,全家便利商店股份有限公司公園分公司,中正區,公園路30號1樓之2,,,,0,301322.402,2771008.164,,,,,,,休閒購物,生活購物,便利商店,,
0970801756,全家便利商店,北投區,中和街252號,全家,,,0,299678.492,2781571.554,www.family.com.tw/Marketing/index.aspx,,0,,,,休閒購物,生活購物,便利商店,,
0981004362,全家便利商店,大安區,羅斯福路四段85號,全家,,,0,303316.755,2767516.958,www.family.com.tw/Marketing/index.aspx,,0,,,,休閒購物,生活購物,便利商店,,
0991003912,全家便利商店,中正區,延平南路68號,,,,,300663.544,2771055.081,,,,,,光復里,休閒購物,生活購物,便利商店,,
1001009268,全家便利商店塔悠店,松山區,塔悠路202號,,,,0,306590.962,2772440.766,,,0,,,鵬程里,休閒購物,生活購物,便利商店,,
1021006082,全家便利商店,內湖區,東湖路43巷4號,,,,,311129.572,2773784.151,,,,,,安湖里,休閒購物,生活購物,便利商店,,
0950100358,OK便利商店芝東門市,士林區,士東路200巷21號,,,,0,303004.466,2778473.261,,,0,,,三玉里,休閒購物,生活購物,便利商店,,
0950100198,OK便利商店,士林區,天母北路12號,,,,0,302236.505,2779313.582,,,0,,,天玉里,休閒購物,生活購物,便利商店,,
0950102142,OK便利商店士林後港店,士林區,後港街152之2號,OK,,,0,301715.695,2775771.118,www.okcvs.com.tw/,OK Chain Store Shilin Hougang Branch,0,,,前港里,休閒購物,生活購物,便利商店,,
0950102260,OK便利商店萬華光復店,萬華區,西園路二段320巷11號,OK,,,0,298837.066,2768999.325,www.okcvs.com.tw/,OK Chain Store Wuanhua Guangfu Branch,0,,,和德里,休閒購物,生活購物,便利商店,,
0950102270,OK便利商店麟光店,信義區,和平東路三段433號,OK,,,0,305519.254,2768225.234,www.okcvs.com.tw/,OK Chain Store Linguang Branch,0,,,黎忠里,休閒購物,生活購物,便利商店,,
0950102215,OK便利商店台北萬美店,文山區,辛亥路四段99號,OK,,,0,305561.555,2766848.422,www.okcvs.com.tw/,OK Chain Store Taipei Wuanmei Branch,0,,,興昌里,休閒購物,生活購物,便利商店,,
0950102162,OK便利商店內湖明湖店,內湖區,東湖路43巷26弄1號,OK,,,0,311078.036,2773864.202,www.okcvs.com.tw/,OK Chain Store Neihu Minghu Branch,0,,,安湖里,休閒購物,生活購物,便利商店,,
0950102168,OK便利商店內湖碧山店,內湖區,內湖路三段91號,OK,,,0,308801.498,2775663.349,www.okcvs.com.tw/,OK Chain Store Neihu Bishan Branch,0,,,金龍里,休閒購物,生活購物,便利商店,,
0950102173,OK便利商店文山忠順店,文山區,興隆路四段68之6號,OK,,,0,305857.819,2764389.728,www.okcvs.com.tw/,OK Chain Store Wenshan Zhongshun Branch,0,,,樟林里,休閒購物,生活購物,便利商店,,
0950102146,OK便利商店士林華齡店,士林區,華齡街2巷20號,OK,,,0,301766.84,2775449.656,www.okcvs.com.tw/,OK Chain Store Shilin Hualing Branch,0,,,前港里,休閒購物,生活購物,便利商店,,
0950102160,OK便利商店內湖民權店,內湖區,民權東路六段296巷33號,OK,,,0,310349.718,2774085.793,www.okcvs.com.tw/,OK Chain Store Neihu Minquan Branch,0,,,葫洲里,休閒購物,生活購物,便利商店,,
0950102230,OK便利商店亞都店,中山區,民權東路二段71巷7號,OK,,,0,302819.215,2773083.331,www.okcvs.com.tw/,OK Chain Store Yiadu Branch,0,,,新福里,休閒購物,生活購物,便利商店,,
0950102143,OK便利商店士林基河店,士林區,基河路250號,OK,,,0,301719.666,2776234.172,www.okcvs.com.tw/,OK Chain Store Shilin Jihe Branch,0,,,福德里,休閒購物,生活購物,便利商店,,
0950102247,OK便利商店致遠店,北投區,致遠一路一段44號,OK,,,0,301256.776,2778099.903,www.okcvs.com.tw/,OK Chain Store Zhiyuan Branch,0,,,石牌里,休閒購物,生活購物,便利商店,,
0950102135,OK便利商店十信工商店,北投區,大業路514號3樓,OK,,,1,299193.96,2780876.856,www.okcvs.com.tw/,OK Chain Store Shihsin High School Branch,0,,,大同里,休閒購物,生活購物,便利商店,,
0950102138,OK便利商店士林天玉店,士林區,天母北路89號,OK,,,0,302290.231,2779683.181,www.okcvs.com.tw/,OK Chain Store Shilin Tianyu Branch,0,,,天母里,休閒購物,生活購物,便利商店,,
0950102176,OK便利商店文山景興店,文山區,景興路40號,OK,,,0,304141.635,2765770.129,www.okcvs.com.tw/,OK Chain Store Wenshan Jingxing Branch,0,,,景華里,休閒購物,生活購物,便利商店,,
0950102183,OK便利商店北投中央店,北投區,中央北路一段208號,OK,,,1,299322.131,2781145.246,www.okcvs.com.tw/,OK Chain Store Beitou Zhongyang Branch,0,,,長安里,休閒購物,生活購物,便利商店,,
0950102140,OK便利商店士林克強店,士林區,中山北路六段193號,OK,,,0,302113.455,2778027.625,www.okcvs.com.tw/,OK Chain Store Shilin Keqiang Branch,0,,,蘭興里,休閒購物,生活購物,便利商店,,
0950102158,OK便利商店中原店,中山區,中原街41號,OK,,,0,302536.332,2772395.74,www.okcvs.com.tw/,OK Chain Store Zhongyuan Branch,0,,,中原里,休閒購物,生活購物,便利商店,,
0950102159,OK便利商店中崙店,松山區,八德路三段12巷5弄48號,OK,,,0,304866.383,2771363.866,www.okcvs.com.tw/,OK Chain Store Zhonglun Branch,0,,,敦化里,休閒購物,生活購物,便利商店,,
0950102179,OK便利商店木柵保儀店,文山區,保儀路100號,OK,,,0,306523.919,2764631.53,www.okcvs.com.tw/,OK Chain Store Muzha Baoyi Branch,0,,,忠順里,休閒購物,生活購物,便利商店,,
0950102167,OK便利商店內湖新明店,內湖區,新明路316號,OK,,,0,307870.358,2772247.957,www.okcvs.com.tw/,OK Chain Store Neihu Xinming Branch,0,,,週美里,休閒購物,生活購物,便利商店,,
0950102144,OK便利商店士林通河店,士林區,通河街141巷1號,OK,,,0,301704.878,2775059.42,www.okcvs.com.tw/,OK Chain Store Shilin Tonghe Branch,0,,,福華里,休閒購物,生活購物,便利商店,,
0950102155,OK便利商店中正三元店,中正區,和平西路二段70巷15弄3號,OK,,,0,300770.541,2769198.623,www.okcvs.com.tw/,OK Chain Store Zhongzheng Sanyuan Branch,0,,,龍興里,休閒購物,生活購物,便利商店,,
0950102148,OK便利商店大同樹德店,大同區,民族西路122號,OK,,,0,301296.515,2773661.671,www.okcvs.com.tw/,OK Chain Store Datong Shude Branch,0,,,斯文里,休閒購物,生活購物,便利商店,,
0950102182,OK便利商店北投中央店,北投區,中央北路一段206號,OK,,,0,299326.577,2781143.06,www.okcvs.com.tw/,OK Chain Store Beitou Zhongyang Branch,0,,,長安里,休閒購物,生活購物,便利商店,,
0950102190,OK便利商店北投磺溪店,北投區,石牌路二段348巷1號,OK,,,0,302110.831,2779712.121,www.okcvs.com.tw/,OK Chain Store Beitou Huangxi Branch,0,,,永欣里,休閒購物,生活購物,便利商店,,
0950102212,OK便利商店台北景雲店,信義區,景雲街22號,OK,,,0,307203.601,2768237.109,www.okcvs.com.tw/,OK Chain Store Taipei Jingyun Branch,0,,,六合里,休閒購物,生活購物,便利商店,,
0950102228,OK便利商店成福店,南港區,成福路44號,OK,,,0,308339.849,2771089.664,www.okcvs.com.tw/,OK Chain Store Chengfu Branch,0,,,鴻福里,休閒購物,生活購物,便利商店,,
0950102254,OK便利商店華山店,中正區,紹興北街8之1號,OK,,,0,302174.413,2771107.787,www.okcvs.com.tw/,OK Chain Store Huashan Branch,0,,,梅花里,休閒購物,生活購物,便利商店,,
0950102196,OK便利商店台北安和店,大安區,安和路二段10巷10號,OK,,,0,304843.004,2769693.459,www.okcvs.com.tw/,OK Chain Store Taipei Anhe Branch,0,,,,休閒購物,生活購物,便利商店,,
0950102134,OK便利商店八德路店,松山區,八德路四段38號,OK,,,0,305591.698,2771438.967,www.okcvs.com.tw/,OK Chain Store Bade Road Branch,0,,,復盛里,休閒購物,生活購物,便利商店,,
0950102136,OK便利商店三民店,松山區,三民路113巷1號,OK,,,0,306006.174,2772516.717,www.okcvs.com.tw/,OK Chain Store Sanmin Branch,0,,,三民里,休閒購物,生活購物,便利商店,,
0950102170,OK便利商店文山木新店,文山區,木新路二段242號,OK,,,0,306372.473,2764256.772,www.okcvs.com.tw/,OK Chain Store Wenshan Muxin Branch,0,,,順興里,休閒購物,生活購物,便利商店,,
0950102185,OK便利商店北投西安店,北投區,致遠二路123號,OK,,,0,300839.145,2779036.724,www.okcvs.com.tw/,OK Chain Store Beitou Xian Branch,0,,,吉利里,休閒購物,生活購物,便利商店,,
0950102263,OK便利商店福林店,士林區,中山北路五段702號,OK,,,0,302380.536,2776920.539,www.okcvs.com.tw/,OK Chain Store Fulin Branch,0,,,福志里,休閒購物,生活購物,便利商店,,
0950102184,OK便利商店北投吉利店,北投區,吉利街140號,OK,,,0,300366.585,2779206.725,www.okcvs.com.tw/,OK Chain Store Beitou Jili Branch,0,,,尊賢里,休閒購物,生活購物,便利商店,,
0950102186,OK便利商店北投店,北投區,中和街488號,OK,,,0,299065.953,2782169.583,www.okcvs.com.tw/,OK Chain Store Beitou Branch,0,,,秀山里,休閒購物,生活購物,便利商店,,
0950102223,OK便利商店台北豐達店,松山區,敦化北路155巷87之1號,OK,,,0,304817.957,2772096.422,www.okcvs.com.tw/,OK Chain Store Taipei Fengda Branch,0,,,中華里,休閒購物,生活購物,便利商店,,
0950102231,OK便利商店延平北路店,大同區,延平北路三段115號,OK,,,0,300719.55,2773641.628,www.okcvs.com.tw/,OK Chain Store Yanping N. Road Branch,0,,,國慶里,休閒購物,生活購物,便利商店,,
0950102203,OK便利商店台北松吉店,信義區,永吉路278巷27弄36號,OK,,,0,307222.806,2771034.773,www.okcvs.com.tw/,OK Chain Store Taipei Songji Branch,0,,,五全里,休閒購物,生活購物,便利商店,,
0950102210,OK便利商店台北酒泉店,大同區,酒泉街227號,OK,,,0,300741.917,2774079.743,www.okcvs.com.tw/,OK Chain Store Taipei Jiuquan Branch,0,,,老師里,休閒購物,生活購物,便利商店,,
0950102252,OK便利商店景美武功店,文山區,羅斯福路五段220號,OK,,,0,303548.148,2766315.238,www.okcvs.com.tw/,OK Chain Store Jingmei Wugong Branch,0,,,萬隆里,休閒購物,生活購物,便利商店,,
0950102256,OK便利商店開封店,萬華區,開封街二段84號,OK,,,0,300086.019,2771290.217,www.okcvs.com.tw/,OK Chain Store Kaifeng Branch,0,,,福星里,休閒購物,生活購物,便利商店,,
0950102141,OK便利商店士林社中店,士林區,社中街386號,OK,,,0,299948.204,2776296.148,www.okcvs.com.tw/,OK Chain Store Shilin Sheznong Branch,0,,,永倫里,休閒購物,生活購物,便利商店,,
0950102157,OK便利商店中坡店,信義區,中坡南路158號,OK,,,0,308127.045,2770501.036,www.okcvs.com.tw/,OK Chain Store Zhongpo Branch,0,,,中行里,休閒購物,生活購物,便利商店,,
